{
  "$schema": "https://json-schema.org/draft/2020-12/schema",
  "$id": "https://github.com/Hearmeman24/blockflow-presets/schema/preset.schema.json",
  "title": "BlockFlow Preset",
  "description": "A self-contained recipe BlockFlow's preset installer can apply to a ComfyGen endpoint. One JSON file per preset.",
  "type": "object",
  "required": ["id", "name", "comfygen_min_version", "workflows", "models", "disk_size_estimate_gb"],
  "properties": {
    "id": {
      "type": "string",
      "pattern": "^[a-z0-9][a-z0-9-]*[a-z0-9]$",
      "minLength": 3,
      "maxLength": 64,
      "description": "Kebab-case identifier (e.g. 'wan22-t2v', 'sdxl-turbo'). Must be globally unique within the registry."
    },
    "name": {
      "type": "string",
      "minLength": 1,
      "maxLength": 80,
      "description": "Display name shown in BlockFlow's preset picker."
    },
    "description": {
      "type": "string",
      "maxLength": 500,
      "description": "One-paragraph explanation of what this preset is + when to pick it."
    },
    "comfygen_min_version": {
      "type": "string",
      "pattern": "^\\d+\\.\\d+\\.\\d+$",
      "description": "Minimum ComfyGen worker version the preset requires (semver). Installer rejects on mismatch."
    },
    "tags": {
      "type": "array",
      "items": {"type": "string", "pattern": "^[a-z0-9][a-z0-9.-]*[a-z0-9]$"},
      "uniqueItems": true,
      "description": "Free-form tags for filtering ('video', 't2v', 'flux', 'turbo', 'wan-2.2', etc.). Lowercase, dots/hyphens allowed for version-like tags."
    },
    "workflows": {
      "type": "array",
      "minItems": 1,
      "description": "One or more ComfyUI workflows attached to this preset. Models are the install unit and shared across all workflows; workflows are alternate ways to drive the same model bundle (e.g. I2V vs V2V variants). The ComfyGen block dropdown shows one entry per workflow.",
      "items": {
        "type": "object",
        "required": ["name"],
        "properties": {
          "name": {
            "type": "string",
            "minLength": 1,
            "maxLength": 60,
            "description": "Display name shown in the ComfyGen block dropdown after the preset name (e.g. 'I2V', 'V2V', 'Image Edit')."
          },
          "json": {
            "type": "object",
            "description": "Inline ComfyUI workflow in API format (node-id-keyed). Mutually exclusive with url+sha256."
          },
          "url": {"type": "string", "format": "uri", "description": "HTTPS URL of the workflow JSON. Pinned to a release tag. Mutually exclusive with json."},
          "sha256": {"type": "string", "pattern": "^[a-f0-9]{64}$", "description": "SHA256 of the workflow JSON for integrity. Required with url."},
          "settings": {
            "type": "array",
            "description": "Optional author-declared knobs surfaced as a 'Workflow Settings' panel in the ComfyGen block. Use this for nodes that aren't picked up by auto-detection (KSampler / LoRA / Resolution / Reference Video / Frame Count / Prompt panels). Empty array or omitted field → no panel. Entries that overlap with auto-detected fields are silently ignored at render time — auto-detection wins.",
            "items": {
              "type": "object",
              "required": ["node_id", "field", "label", "type"],
              "properties": {
                "node_id": {
                  "type": "string",
                  "description": "Node ID in the workflow whose input this knob edits."
                },
                "field": {
                  "type": "string",
                  "description": "Name of the input field on the target node."
                },
                "label": {
                  "type": "string",
                  "minLength": 1,
                  "maxLength": 60,
                  "description": "Display label shown next to the widget."
                },
                "type": {
                  "type": "string",
                  "enum": ["int", "float", "string", "bool", "combo"],
                  "description": "Widget type. int/float → numeric input; string → text input; bool → checkbox; combo → select with choices."
                },
                "description": {
                  "type": "string",
                  "maxLength": 240,
                  "description": "Optional short helper text shown below the widget."
                },
                "min": {"type": "number"},
                "max": {"type": "number"},
                "step": {"type": "number", "exclusiveMinimum": 0},
                "choices": {
                  "type": "array",
                  "items": {"type": "string"},
                  "description": "Allowed values for combo widgets. Required when type=combo, ignored otherwise."
                }
              },
              "additionalProperties": false,
              "allOf": [
                {
                  "if": {"properties": {"type": {"const": "combo"}}, "required": ["type"]},
                  "then": {"required": ["choices"], "properties": {"choices": {"minItems": 1}}}
                }
              ]
            }
          },
          "smoke_inputs": {
            "type": "array",
            "description": "Optional fixture inputs for ComfyGen's CI smoke gate. Each entry patches one input field on a specific node before the smoke-test submit. Workflows with no file inputs (pure prompt-driven, e.g. T2I) omit this field. BlockFlow's installer ignores this field; it's consumed by the smoke gate only.",
            "items": {
              "type": "object",
              "required": ["node_id", "field", "url", "sha256", "filename"],
              "properties": {
                "node_id": {
                  "type": "string",
                  "description": "Node ID in the workflow whose input should be patched (e.g. '311' for a LoadImage node, '417' for VHS_LoadVideo)."
                },
                "field": {
                  "type": "string",
                  "description": "Input field name on the target node — typically 'image', 'video', 'audio', or 'mask'."
                },
                "url": {
                  "type": "string",
                  "format": "uri",
                  "description": "HTTPS URL of the fixture file. By convention lives under registry/<id>/fixtures/."
                },
                "sha256": {
                  "type": "string",
                  "pattern": "^[a-f0-9]{64}$",
                  "description": "SHA256 of the fixture file for integrity."
                },
                "filename": {
                  "type": "string",
                  "description": "Local filename the smoke gate writes to before submission. Matches the node's expected basename convention."
                }
              },
              "additionalProperties": false
            }
          }
        },
        "oneOf": [
          {"required": ["json"], "not": {"required": ["url"]}},
          {"required": ["url", "sha256"], "not": {"required": ["json"]}}
        ],
        "additionalProperties": false
      }
    },
    "models": {
      "type": "array",
      "minItems": 1,
      "items": {
        "type": "object",
        "required": ["source", "url", "dest", "sha256", "size_gb"],
        "properties": {
          "source": {
            "type": "string",
            "enum": ["huggingface", "civitai", "github-release", "https"],
            "description": "Where the model lives. Affects how the installer authenticates the download."
          },
          "url": {
            "type": "string",
            "format": "uri",
            "description": "Direct download URL. For huggingface/civitai, the installer will inject the user's API token at install time."
          },
          "dest": {
            "type": "string",
            "pattern": "^(checkpoints|loras|vae|controlnet|clip|clip_vision|embeddings|upscale_models|configs|diffusion_models|text_encoders|unet|detection)/[A-Za-z0-9._/-]+$",
            "description": "Path on the ComfyGen network volume, under the appropriate ComfyUI models subfolder."
          },
          "sha256": {
            "type": "string",
            "pattern": "^[a-f0-9]{64}$",
            "description": "REQUIRED. SHA256 hash of the file (hex, lowercase). ComfyGen's worker uses this for content-addressable dedup — if the file already exists at the destination with this hash, the download is skipped (cached: true). For HuggingFace LFS files, fetch via the API: GET /api/models/<repo>/tree/<branch>?recursive=1 returns lfs.oid per file."
          },
          "size_gb": {
            "type": "number",
            "minimum": 0,
            "maximum": 500,
            "description": "Approximate size in GB. Sum across all models must match disk_size_estimate_gb (±10%)."
          }
        },
        "additionalProperties": false
      }
    },
    "disk_size_estimate_gb": {
      "type": "number",
      "minimum": 1,
      "maximum": 1000,
      "description": "Total GB the preset needs on the ComfyGen volume (sum of all model files plus a ~20% buffer for temp + cache)."
    },
    "tested_against": {
      "type": "object",
      "description": "What the preset author tested before proposing.",
      "properties": {
        "comfygen_version": {"type": "string"},
        "gpu_tier": {"type": "string", "enum": ["budget", "recommended", "performance"]},
        "note": {"type": "string", "maxLength": 200}
      }
    },
    "recommendations": {
      "type": "object",
      "description": "Optional prose tips surfaced inline in the ComfyGen block. `global` applies to every workflow in the preset; `workflows` keys map workflow display names to their own tip lists. Both scopes optional.",
      "properties": {
        "global": {
          "type": "array",
          "items": {"type": "string", "maxLength": 200}
        },
        "workflows": {
          "type": "object",
          "additionalProperties": {
            "type": "array",
            "items": {"type": "string", "maxLength": 200}
          }
        }
      },
      "additionalProperties": false
    }
  },
  "additionalProperties": false
}
